{"actor_id":"RED","authority_mode":"SHADOW","caused_by":null,"command_hash":"1a419bbca175ed4888fa3907a33531e34794e3159914fa38a937f8d981835a14","command_id":"CMD-01a06273-bff9-7eb3-8390-fef3df579d9c","command_result":"ACCEPTED","correlation_id":"gate-c-midas-06-increment2","effective_at":null,"event_id":"EVT-01a06273-bff9-7eb3-8390-fef3df579d9c","event_type":"ResolutionVerified","evidence_refs":["AGENTS/RED/reports/2026-09-02_KERNEL_GATE_C_SITTING2_MIDAS06_VERIFICATION.md","AGENTS/RED/reports/2026-09-01_KERNEL_GATE_C_SITTING2_MIDAS06_VERIFICATION_STOP.md","AGENTS/MIDAS/workbook/PREDICTIONS.tsv#id=MIDAS-06","AGENTS/MIDAS/outbox/kernel/submissions/CMD-01a05d61-fb0b-7e3d-b41e-e8432c3c9f1d.json","https://fred.stlouisfed.org/series/DFII10","https://www.cmegroup.com/markets/metals/precious/gold.settlements.html"],"native_refs":[{"locator":"/verification","locator_type":"JSON_POINTER","path":"AGENTS/RED/outbox/kernel/MIDAS-06_VERIFY_NATIVE_COMPANION.json","raw_record_sha256":"18342acaa4e05b591910fd75cc3d1dfbda2f7b1f3eacd27138d6033a890f998f","repository":"williepowen-debug/Research-workspace","source_commit":"ab909bb63dc10dbb9628f5fae2c5b41f1866d081"}],"object_id":"R-01a05d61-fb0b-7848-a239-6820d48fd4fc","object_type":"RESOLUTION","payload":{"disposition":"VERIFY","question_id":"Q-019306a1-4c00-7000-8000-00000000006a","resolution_id":"R-01a05d61-fb0b-7848-a239-6820d48fd4fc","verification_evidence_refs":["AGENTS/RED/reports/2026-09-02_KERNEL_GATE_C_SITTING2_MIDAS06_VERIFICATION.md","AGENTS/RED/reports/2026-09-01_KERNEL_GATE_C_SITTING2_MIDAS06_VERIFICATION_STOP.md","AGENTS/MIDAS/workbook/PREDICTIONS.tsv#id=MIDAS-06","AGENTS/MIDAS/outbox/kernel/submissions/CMD-01a05d61-fb0b-7e3d-b41e-e8432c3c9f1d.json","https://fred.stlouisfed.org/series/DFII10","https://www.cmegroup.com/markets/metals/precious/gold.settlements.html"],"verified_by":"RED","verified_outcome_value":"YES"},"policy_version":"kernel.policy.1","previous_event_id":"EVT-01a05d61-fb0b-7e3d-b41e-e8432c3c9f1d","recorded_at":"2026-09-02T14:12:41.974242Z","schema_version":"kernel.schema.1","stream_id":"QS-Q-019306a1-4c00-7000-8000-00000000006a","stream_version":4,"submitted_at":"2026-09-02T14:09:08.089994Z","writer_id":"PROME","writer_version":"kernel.writer.1"}
