[{"actor_id":"SAM","authority_mode":"SHADOW","caused_by":"EVT-018f22e2-7d00-7000-8000-000000000003","command_hash":"ff7523808d63b65adc4235d907dff086068380397426e3e32095d75dfb4aa0d8","command_id":"CMD-018f22e2-7d00-7000-8000-000000000002","command_result":"ACCEPTED","correlation_id":"fixture-binary-001","effective_at":null,"event_id":"EVT-018f22e2-7d00-7000-8000-000000000004","event_type":"ForecastSubmitted","evidence_refs":[],"native_refs":[{"locator":"FIX-F-001","locator_type":"TSV_RECORD_ID","path":"KERNEL/tests/fixtures/native/predictions.tsv","raw_record_sha256":"bbbbbbbbbbbbbbbbbbbbbbbbbbbbbbbbbbbbbbbbbbbbbbbbbbbbbbbbbbbbbbbb","repository":"williepowen-debug/Research-workspace","source_commit":"aaaaaaaaaaaaaaaaaaaaaaaaaaaaaaaaaaaaaaaa"}],"object_id":"F-018f22e2-7d00-7000-8000-000000000006","object_type":"FORECAST","payload":{"decision_consequence":null,"evidence_refs":["fixture://evidence"],"forecast_id":"F-018f22e2-7d00-7000-8000-000000000006","forecast_version":1,"forecaster_actor_id":"SAM","information_as_of":"2026-08-25T12:00:00.000000Z","intervention_stage":"INITIAL","probability":0.65,"question_id":"Q-018f22e2-7d00-7000-8000-000000000005","rationale_ref":"fixture://rationale"},"policy_version":"kernel.policy.1","previous_event_id":null,"recorded_at":"2026-08-25T12:06:00.000000Z","schema_version":"kernel.schema.1","stream_id":"FS-F-018f22e2-7d00-7000-8000-000000000006","stream_version":1,"submitted_at":"2026-08-25T12:05:00.000000Z","writer_id":"PROME","writer_version":"kernel.writer.1"}]
